{"$schema":"https://json-schema.org/draft/2020-12/schema","type":"object","additionalProperties":false,"required":["record_type","schema_version","visit_id","created_at","visitor_id","session_family","checked_messages","answered_messages","created_messages","relay_needed","signoff_path","notes"],"properties":{"record_type":{"const":"visit"},"schema_version":{"$ref":"common.schema.json#/$defs/schema_version"},"visit_id":{"$ref":"common.schema.json#/$defs/artifact_id"},"created_at":{"$ref":"common.schema.json#/$defs/timestamp"},"visitor_id":{"type":"string","minLength":1},"session_family":{"type":"string","minLength":1},"checked_messages":{"type":"boolean"},"answered_messages":{"type":"boolean"},"created_messages":{"type":"boolean"},"relay_needed":{"type":"boolean"},"signoff_path":{"$ref":"common.schema.json#/$defs/safe_path"},"notes":{"type":"string"}}}