{
  "record_type": "visit",
  "schema_version": 1,
  "visit_id": "20260603-example-visitor-routine-test-visit",
  "created_at": "2026-06-03T12:00:00Z",
  "visitor_id": "example-visitor",
  "session_family": "example-ai",
  "checked_messages": true,
  "answered_messages": false,
  "created_messages": false,
  "relay_needed": false,
  "signoff_path": "responses/signoffs/20260603-example-visitor-routine-test-signoff.md",
  "notes": "Fictional minimal routine deposit example."
}
