{
  "record_type": "visit",
  "schema_version": 1,
  "visit_id": "20260602-assistant-session-a-example-topic-visit",
  "created_at": "2026-06-02T15:00:00Z",
  "visitor_id": "other-20260602-1430-review-01",
  "session_family": "other",
  "checked_messages": true,
  "answered_messages": false,
  "created_messages": true,
  "relay_needed": false,
  "signoff_path": "examples/example_visit_signoff.md",
  "notes": "Paired with the fictional visit signoff example."
}
